cluster_id,label,keywords,estimated_volume,is_flagged,momentum_pct,sample_review_1,sample_review_2,sample_review_3
0,General App Feedback,"movies, that, movie",65,True,-71.4,would give 5 stars but u guys bring alot of movie very late I mean try bringing movie fast,it's not that bad but not that good cuz sum movie that I wanted to watch wasn't there so....,the movies hardly work
4,General App Feedback,,54,True,-66.7,"Greedy bastards only want money now, seems they've forgotten how they got so famous in the first place. Long ago when th",greedy and disgusting company that would rather put their money towards funding shows that exploit children than having ,Very high price and not worth the money.
1,Video & Streaming Playback,netflix,50,True,-83.3,Was great until they started banning account sharing. I own two homes but my family in one of the homes can't use my acc,Gone downhill in another major way by taking away the ability to cast from your phone. First it was limiting account sha,"what is not to like about Netflix, sharing accounts with your loved ones, watching tv or movies together."
2,General App Feedback,worth,43,True,-50.0,"it's pointless to get this app for the phone! you can't even see anything the screen goes black, but you can hear everyt",Why Screentouch Speed feature Stopped. Giving daily updates for app means you are not able to control quality of release,Search with Galaxy tablet attached keyboard in-app is not working now. Can only use on-screen keyboard. Please rectify
3,General App Feedback,,37,True,-33.3,"I've been having language selection issues for a while now. The issue hasn't been resolved.After I fix it, it breaks aga",I don't understand why movies in languages other than English are not in a separate category. Give users the option to s,It doesn't have Hindi dubbing for all shows. There is just 1% hindi dubbing. So it is hard to understand the content eve
5,General App Feedback,,37,True,-50.0,"This is for cancelling shows like Mindhunter and 1989, recasting Henry cavill and overall butchering Witcher franchise a","They keep removing THE GOOD SHOWS, REMOVE THE BAD SHOWS!",Would be more if I could see more than 4 shows at a time
